"nid","alias","title","body"
"1",,"Home","<p><p>Aliis pluribus ad comitatum imperatoris vinctum perduceret: quo percitus ille exitio urgente abrupto ferro eundem adoritur paulum. et quia languente dextera, letaliter ferire non potuit, iam districtum mucronem in proprium latus inpegit. hocque deformi genere mortis excessit e vita iustissimus rector ausus miserabiles casus levare multorum. hinc ille commotus ut iniusta perferens et indigna praefecti custodiam protectoribus mandaverat fidis. quo conperto montius tunc quaestor acer quidem sed ad lenitatem propensior, consulens in commune advocatos palatinarum primos scholarum adlocutus est mollius docens nec decere haec fieri nec prodesse addensque vocis obiurgatorio sonu quod si id placeret, post statuas constantii deiectas super adimenda vita praefecto conveniet securius cogitari. constituendi autem sunt qui sint in amicitia fines et quasi termini diligendi. de quibus tres video sententias ferri, quarum nullam probo, unam, ut eodem modo erga amicum adfecti simus, quo erga nosmet ipsos, alteram, ut nostra in amicos benevolentia illorum erga nos benevolentiae pariter aequaliterque respondeat, tertiam, ut, quanti quisque se ipse facit, tanti fiat ab amicis. eodem tempore etiam hymetii praeclarae indolis viri negotium est actitatum, cuius hunc novimus esse textum. cum.</p>

<p>Occulte, incertum quo locante vel cuius usibus apparatum. ideoque rector provinciae tunc pater apollinaris eiusdem nominis ut conscius ductus est aliique congregati sunt ex diversis civitatibus multi, qui atrocium criminum ponderibus urgebantur.</p>

<p>Perfecto et spectato viro. per hoc minui studium suum existimans paulus, ut erat in conplicandis negotiis artifex dirus, unde ei catenae inditum est cognomentum, vicarium ipsum eos quibus praeerat adhuc defensantem ad sortem periculorum communium traxit. et instabat ut eum quoque cum tribunis et aliis pluribus ad comitatum imperatoris vinctum perduceret: quo percitus ille exitio urgente abrupto ferro eundem adoritur paulum. et quia languente dextera, letaliter ferire non potuit, iam districtum mucronem in proprium latus inpegit. hocque deformi genere mortis excessit e vita iustissimus rector ausus miserabiles casus levare multorum. hinc ille commotus ut iniusta perferens et indigna praefecti custodiam protectoribus mandaverat fidis. quo conperto montius tunc quaestor acer quidem sed ad lenitatem propensior, consulens in commune advocatos palatinarum primos scholarum adlocutus est mollius docens nec decere haec fieri nec prodesse addensque vocis obiurgatorio sonu quod si id placeret, post statuas constantii deiectas super adimenda vita praefecto conveniet securius cogitari. constituendi autem sunt qui sint in amicitia fines et quasi termini diligendi. de quibus tres video sententias ferri, quarum nullam probo, unam.</p>

<p>Et ab eis ita amantur ut facile earum sensus appareat. quod in homine multo est evidentius, primum ex ea caritate quae est inter natos et parentes, quae dirimi nisi detestabili scelere non potest; deinde cum similis sensus exstitit amoris, si aliquem nacti sumus cuius cum moribus et natura congruamus, quod in eo quasi lumen aliquod probitatis et virtutis perspicere videamur. quam ob rem vita quidem talis fuit vel fortuna vel gloria, ut nihil posset accedere, moriendi autem sensum celeritas abstulit; quo de genere mortis difficile dictu est; quid homines suspicentur, videtis; hoc vere tamen licet dicere, p. scipioni ex multis diebus, quos in vita celeberrimos laetissimosque viderit, illum diem clarissimum fuisse, cum senatu dimisso domum reductus ad vesperum est a patribus conscriptis, populo romano, sociis et latinis, pridie quam excessit e vita, ut ex tam alto dignitatis gradu ad superos videatur deos potius quam ad inferos pervenisse. rogatus ad ultimum admissusque in consistorium ambage nulla praegressa inconsiderate et leviter proficiscere inquit ut praeceptum est, caesar sciens quod si cessaveris, et tuas et palatii.</p>

<p>Montuosis etiam et silvestribus, in quibus diutius commorati sumus. tu autem, fanni, quod mihi tantum tribui dicis quantum ego nec adgnosco nec postulo, facis amice; sed, ut mihi videris, non recte iudicas de catone; aut enim nemo, quod quidem magis credo, aut si quisquam, ille sapiens fuit. quo modo, ut alia omittam, mortem filii tulit! memineram paulum, videram galum, sed hi in pueris, cato in perfecto et spectato viro. per hoc minui studium suum existimans paulus, ut erat in conplicandis negotiis artifex dirus, unde ei catenae inditum est cognomentum, vicarium ipsum eos quibus praeerat adhuc defensantem ad sortem periculorum communium traxit. et instabat ut eum quoque cum tribunis et aliis pluribus ad comitatum imperatoris vinctum perduceret: quo percitus ille exitio urgente abrupto ferro eundem adoritur paulum. et quia languente dextera, letaliter ferire non potuit, iam districtum mucronem in proprium latus inpegit. hocque deformi genere mortis excessit e vita iustissimus rector ausus miserabiles casus levare multorum. hinc ille commotus ut.</p>

<p>Rogatus ad ultimum admissusque in consistorium ambage nulla praegressa inconsiderate et leviter proficiscere inquit ut praeceptum est, caesar sciens quod si cessaveris, et tuas et palatii tui auferri iubebo prope diem annonas. hocque solo contumaciter dicto subiratus abscessit nec in conspectum eius postea venit saepius arcessitus. dein syria per speciosam interpatet diffusa planitiem. hanc nobilitat antiochia, mundo cognita civitas, cui non certaverit alia advecticiis ita adfluere copiis et internis, et laodicia et apamia itidemque seleucia iam inde a primis auspiciis florentissimae. quae dum ita struuntur, indicatum est apud tyrum indumentum regale textum occulte, incertum quo locante vel cuius usibus apparatum. ideoque rector provinciae tunc pater apollinaris eiusdem nominis ut conscius ductus est aliique congregati sunt ex diversis civitatibus multi, qui atrocium criminum ponderibus urgebantur.</p>

<p>Leviter proficiscere inquit ut praeceptum est, caesar sciens quod si cessaveris, et tuas et palatii tui auferri iubebo prope diem annonas. hocque solo contumaciter dicto subiratus abscessit nec in conspectum eius postea venit saepius arcessitus. dein syria per speciosam interpatet diffusa planitiem. hanc nobilitat antiochia, mundo cognita civitas, cui non certaverit.</p>

<p>Tribui dicis quantum ego nec adgnosco nec postulo, facis amice; sed, ut mihi videris, non recte iudicas de catone; aut enim nemo, quod quidem magis credo, aut si quisquam, ille sapiens fuit. quo modo, ut alia omittam, mortem filii tulit! memineram paulum, videram galum, sed hi in pueris, cato in perfecto et spectato viro. per hoc minui studium suum existimans paulus, ut erat in conplicandis negotiis artifex dirus, unde ei catenae inditum est cognomentum, vicarium ipsum eos quibus praeerat adhuc defensantem ad sortem periculorum communium traxit. et instabat ut eum quoque cum tribunis et aliis pluribus ad comitatum imperatoris vinctum perduceret: quo percitus.</p>

<p>Iam districtum mucronem in proprium latus inpegit. hocque deformi genere mortis excessit e vita iustissimus rector ausus miserabiles casus levare multorum. hinc ille commotus ut iniusta perferens et indigna praefecti custodiam protectoribus mandaverat fidis. quo conperto montius tunc quaestor acer quidem sed ad lenitatem propensior, consulens in commune advocatos palatinarum primos scholarum adlocutus est mollius docens nec decere haec fieri nec prodesse.</p>

<p>Comitatum imperatoris vinctum perduceret: quo percitus ille exitio urgente abrupto ferro eundem adoritur paulum. et quia languente dextera, letaliter ferire non potuit, iam districtum mucronem in proprium latus inpegit. hocque deformi genere mortis excessit e vita iustissimus rector ausus miserabiles casus levare multorum. hinc ille commotus ut iniusta perferens et indigna praefecti custodiam protectoribus mandaverat fidis. quo conperto montius tunc quaestor acer quidem sed ad lenitatem propensior, consulens in commune advocatos palatinarum primos scholarum adlocutus est mollius docens nec decere haec fieri.</p>
</p>"
"2","/about","About","<p>Lorem ipsum dolor sit amet, consectetur adipiscing elit, sed do eiusmod tempor incididunt ut labore et dolore magna aliqua. Ut enim ad minim veniam, quis nostrud exercitation ullamco laboris nisi ut aliquip ex ea commodo consequat. Duis aute irure dolor in reprehenderit in voluptate velit esse cillum dolore eu fugiat nulla pariatur. Excepteur sint occaecat cupidatat non proident, sunt in culpa qui officia deserunt mollit anim id est laborum.</p>"
