"IRPU9AG5","thesis","1996","Losier, Mary J. O.","""Oui, Dieu Le Veut"": The Life and Times of Amanda Viger, Soeur Saint Jean-De-Goto","","","","","https://login.proxy.hil.unb.ca/login?url=https://www-proquest-com.proxy.hil.unb.ca/docview/304331195?accountid=14611","Catholic, Women religious, Medicine","1996","2022-01-19 18:32:56","2022-01-19 18:32:56","","","186","","","","","","","","","","University of New Brunswick (Canada)","Fredericton, NB","English","","M.A.","UNBF","","","","","","/home/cvillami/Zotero/storage/KE7Q3ZZ3/Losier - 1996 - Oui, dieu le veut The life and times of Amanda .pdf","","","Social sciences; New Brunswick; Language; literature and linguistics","","","","","","","","","","","","","","","","","","","","","","","","","","","","","","","","","","","","","","","","","","","","","",""
"F2WZZEHG","journalArticle","1972","Little, John I.","New Brunswick Reaction to the Manitoba Schools Question","Acadiensis","","","","https://journals-lib-unb-ca.proxy.hil.unb.ca/index.php/Acadiensis/article/view/11302/12052","Catholic, Schools","1972","2022-01-19 18:32:56","2022-01-19 18:32:56","","43-58","","2","1","","","","","","","","","","","","","UNBF","","","","","","","","","","","","","","","","","","","","","","","","","","","","","","","","","","","","","","","","","","","","","","","","","","","","","","",""
"CWTK2NLT","book","1981","","St. Alphonsus Church, Hampton, N.B., Dedicated May 31, 1981","","","","","","Catholic","1981","2022-01-19 18:32:56","2022-01-19 18:32:56","","","31","","","","","","","","","","The Parish","Hampton, NB","","","","UNBF, Legislative Library, Fredericton","","","","","Cover title","","","","New Brunswick; Church history; Kings County Hampton; Catholic Church History","Logie, Mildred","","","","","","","","","","","","","","","","","","","","","","","","","","","","","","","","","","","","","","","","","","","","",""
"FAS275F7","journalArticle","2016","Ludlow, Peter","Raising the Cry of Nationality","Island Magazine","","03848175","","","Catholic, Acadian, Irish, Scots, Prince Edward Island","2016","2022-01-19 18:32:56","2022-01-19 18:32:56","","2-10","","80","","","","","","","","","","","","","","UNBF, NBM, MtA, Acadia, Dalhousie","","","","","<p>Accession Number: 120582479; Ludlow, Peter; Source Info: Fall/Winter2016, Issue 80, p2; Historical Period: 1772 to 1912; Subject Term: CATHOLIC Church -- Canada -- History; Subject Term: PRINCE Edward Island -- History -- 20th century; Subject Term: CATHOLIC bishops -- Appointment, call, & election; Subject Term: IRISH -- Canada; Subject Term: SCOTS -- Canada; Subject Term: MARITIME Provinces -- Religion; Number of Pages: 9p; Document Type: Article</p>; <p>Accession Number: 120582479; Ludlow, Peter; Source Info: Fall/Winter2016, Issue 80, p2; Historical Period: 1772 to 1912; Subject Term: CATHOLIC Church -- Canada -- History; Subject Term: PRINCE Edward Island -- History -- 20th century; Subject Term: CATHOLIC bishops -- Appointment, call, & election; Subject Term: IRISH -- Canada; Subject Term: SCOTS -- Canada; Subject Term: MARITIME Provinces -- Religion; Number of Pages: 9p; Document Type: Article</p>","","","CATHOLIC bishops -- Appointment, call, & election; CATHOLIC Church -- Canada -- History; IRISH -- Canada; MACDONALD, James Charles; MARITIME Provinces -- Religion; O'LEARY, Henry; PRINCE Edward Island -- History -- 20th century; SCOTS -- Canada","","","","","","","","","","","","","","","","","","","","","","","","","","","","","","","","","","","","","","","","","","","","","","",""
"PVA6FMIK","bookSection","2015","MacDonald, Heidi; Burton, Emily","Avoiding and Exaggerating Renewal: Maritime Catholic Newspapers' Reporting on Women Religious, 1962-1975","Understanding the Consecrated Life in Canada: Essays on Contemporary Trends","978-1-77112-137-8","","","","Women religious, Catholic, Newspapers","2015","2022-01-19 18:32:56","2022-01-19 18:32:56","","153-163","","","","","","","","","","","Wilfred Laurier U.P.","Waterloo, ON","English","","","UNBSJ, MtA, SMU","","","","","","","","","","Zuidema, Jason","","","","","","","","","","","","","","","","","","","","","","","","","","","","","","","","","","","","","","","","","","","","",""
"FYPPN3CW","book","1874","Maher, Henry; Great Britain. Privy Council; Portland (N.B.). Town Council","New Brunswick School Act, the Argument Before the Privy Council of Great Britain: In the Judicial Committee of the Privy Council, July 17, 1874 ... Maher vs. the Town Council of the Town of Portland","","","","","https://archive.org/details/cihm_09657","Catholic, Schools","1874","2022-01-19 18:32:56","2022-01-19 18:32:56","","","14","","","","","","CIHM/ICMH microfiche series ; no. 09657","","","","N.p.","","English","","","Dalhousie, UNBF (mic)","","","","","","","","","","","","","","","","","","","","","","","","","","","","","","","","","","","","","","","","","","","","","","","","","","","","","","",""
"TRSNUJU4","book","1939","Université Saint-Joseph","Album Historique Publie a l'occasion des fetes du 75e anniversaire 13-14 Juin 1939/Historical album Published on the occasion of the 75th Anniversary June 13-14 1939","","","","","","Catholic","1939","2022-01-19 18:32:56","2022-01-19 18:32:56","","","56","","","","","","","","","","Université Saint-Joseph","Saint Joseph, NB","French","","","UdeM, BAnQ, Toronto Public Library","","","","","","/home/cvillami/Zotero/storage/L23HP849/Album-Historique-Publie-a-loccasiondes-fetes-du-75e-anniversaire-13-14-Juin-1939Historical-albu.html","","","","","","","","","","","","","","","","","","","","","","","","","","","","","","","","","","","","","","","","","","","","","","","","",""
"CYW4HCER","journalArticle","1998","Vautour, Thérèse","Historique des Religieuses de Notre-Dame-du-Sacré-Coeur","Les Cahiers. Societé historique-acadienne","","","","https://societehistoriqueacadienne.files.wordpress.com/2018/04/2904_total.pdf","","1998-12","2022-01-19 18:32:56","2022-01-19 18:32:56","","206-221","","4","29","","","","","","","","","","","","","","","","","","","","","","","","","","","","","","","","","","","","","","","","","","","","","","","","","","","","","","","","","","","","","","","","","","","",""
"RERJ9ZCJ","book","1980","Michaud, Guy R.","La Paroisse de l'Immaculée Conception, Edmundston, N.-B., 1880-1980","","","","","","Catholic, Parish history","1980","2022-01-19 18:32:56","2022-01-19 18:32:56","","","455","","","","","","","","","","Guy R. Michaud","Edmundston, NB","French","","","Legislative Library, Fredericton","","","","","","","","","","","","","","","","","","","","","","","","","","","","","","","","","","","","","","","","","","","","","","","","","","","","","","",""
"8KQRCY63","thesis","1992","Boucher, Neil","Acadian Nationalism and the Episcopacy of Msgr. Edouard-Alfred Leblanc, Bishop of Saint John, New Brunswick (1912-1935): A Maritime Chapter of Canadian Ethno-Religious History","","","","","http://hdl.handle.net/10222/55345","Catholic, Clergy","1992","2022-01-19 18:32:56","2022-01-19 18:32:56","","","385","","","","","Acadian Nationalism and the Episcopacy of Msgr. Edouard-Alfred Leblanc, Bishop of Saint John, New Brunswick (1912-1935)","","","","","Dalhousie University","Halifax, NS","","","Ph.D.","UdeM","","","","","","/home/cvillami/Zotero/storage/X5ALFKI5/results.html","","","","","","","","","","","","","","","","","","","","","","","","","","","","","","","","","","","","","","","","","","","","","","","","",""
"4646B75G","thesis","1940","LeGresley, Léandre","Le Facteur religieux en Acadie","","","","","","Catholic","1940","2022-01-19 18:32:56","2022-01-19 18:32:56","","","165","","","","","","","","","","Université Sacré-Coeur","Bathurst-Ouest, NB","","","Ph.D.","UdeM","","","","","","","","","","","","","","","","","","","","","","","","","","","","","","","","","","","","","","","","","","","","","","","","","","","","","","",""
"IIB7GFQI","journalArticle","2007","MacPherson, Iain S.; MacDonald, Edward","Soul and Body, Sound and Hearty: Getting to Know Bishop Maceachern","Island Magazine","","03848175","","","Catholic, Clergy, Personal correspondence","2007","2022-01-19 18:32:56","2022-01-19 18:32:56","","14-18","","62","","","","","","","","","","","","","","UNBF","","","","","<p>Accession Number: 45889483; MacPherson, Iain S.; MacDonald, Edward; Source Info: Fall/Winter2007, Issue 62, p14; Note: Map, 3 photos, 3 notes, ref.; Historical Period: 1790 to 1832; Subject Term: BISHOPS; Subject Term: LETTERS; Subject Term: SCOTS; Subject: CANADA; Subject: PRINCE Edward Island; Number of Pages: 5p; Document Type: Article</p>; <p>Accession Number: 45889483; MacPherson, Iain S.; MacDonald, Edward; Source Info: Fall/Winter2007, Issue 62, p14; Note: Map, 3 photos, 3 notes, ref.; Historical Period: 1790 to 1832; Subject Term: BISHOPS; Subject Term: LETTERS; Subject Term: SCOTS; Subject: CANADA; Subject: PRINCE Edward Island; Number of Pages: 5p; Document Type: Article</p>","","","CANADA; BISHOPS; CATHOLIC Church; LETTERS; MacEachern, Angus Bernard; PRINCE Edward Island; SCOTS; Walker, Angus","","","","","","","","","","","","","","","","","","","","","","","","","","","","","","","","","","","","","","","","","","","","","","",""
"GC7X8WLV","book","2001","Théophile","Pourquoi le ciel visite-t-il la terre?","","978-0-9689127-0-6","","","","Catholic, Doctrine","2001","2022-01-19 18:32:56","2022-01-19 18:32:56","","","198","","","","","","","","","","Theomir Enr.","Rogersville, NB","French","","","Legislative Library, Fredericton, UdeM","","","","","","","","","Catholic Church; Doctrines; Eglise catholique","","","","","","","","","","","","","","","","","","","","","","","","","","","","","","","","","","","","","","","","","","","","","",""
"6UU9KKYD","bookSection","2002","Vautour, Thérèse","Les Sœurs de la Charité de l'Immaculée-Conception à Memramcook","Histoire d'une servante centenaire: Couvent Notre-Dame-du-Sacré-Cœur","2-923016-00-9","","","","Catholic, Women religious","2002","2022-01-19 18:32:56","2022-01-19 18:32:56","","15-57","","","","","","","","","","","Les Éditions de la Francophonie","Moncton, NB","French","","","UdeM","","","","","","","","","","","","","","","","","","","","","","","","","","","","","","","","","","","","","","","","","","","","","","","","","","","","","","",""
"GGIF3MST","book","","Vital, Henri","La Vie mariale des Hospitalièrs de Saint-Joseph au Nouveau-Brunswick","","","","","","Catholic, Medicine","1960s","2022-01-19 18:32:56","2022-01-19 18:32:56","","","44","","","","","","","","","","Province Notre-Dame de l'Assomption, Les Hospitalièrs de Saint-Joseph","Vallée-Lourdes, NB","","","","Legislative Library, Fredericton, UdeM, USainteAnne","","","","","","","","","","","","","","","","","","","","","","","","","","","","","","","","","","","","","","","","","","","","","","","","","","","","","","",""
"CBHD4XY4","journalArticle","1956","Mercier, Jean","Les Fondateurs de l'Église canadienne et l'Acadie","Vie française","","","","","","1956-06","2022-01-19 18:32:56","2022-01-19 18:32:56","","289-297","","","10","","","","","","","","","","","","","UdeM","","","","","","","","","","","","","","","","","","","","","","","","","","","","","","","","","","","","","","","","","","","","","","","","","","","","","","",""
"7G5ZPL5R","journalArticle","1950","Mercereau, C. J.","Early Missions Along Bay Chaleur","Report - Canadian Catholic Historical Association","","","","http://www.cchahistory.ca/journal/CCHA1950/Mersereau.pdf","Catholic, Missions","1950","2022-01-19 18:32:56","2022-01-19 18:32:56","","21-31","","","17","","","","","","","","","","","","","UNBF, UdeM, MtA, Acadia","","","","","","","","","","","","","","","","","","","","","","","","","","","","","","","","","","","","","","","","","","","","","","","","","","","","","","",""
"33IBJY9P","book","1979","LaPlante, A. L.","Le College De Bathurst- Chronique- Des Annees 1949 a 1975","","","","","","Catholic, Education","1979","2022-01-19 18:32:56","2022-01-19 18:32:56","","","428","","","","","","","","","","Université de Moncton","Moncton, NB","French","","","UNBF","","","","","","/home/cvillami/Zotero/storage/UMSBL2V4/Le-College-De-Bathurst--Chronique--Des-Annees-1949-a-1975-LaPlante-AL.html","","","","","","","","","","","","","","","","","","","","","","","","","","","","","","","","","","","","","","","","","","","","","","","","",""
"RXDWKLEN","journalArticle","1941","Caron, I.","Les Pères capucins en Acadie","Bulletin des recherches historiques","","","","","Catholic, Capuchins","1941","2022-01-19 18:32:56","2022-01-19 18:32:56","","128-131","","5","XLVII","","","","","","","","","","","","","UNBF","","","","","","","","","","","","","","","","","","","","","","","","","","","","","","","","","","","","","","","","","","","","","","","","","","","","","","",""
"RFTGK8FJ","book","1883","Rogers, James; Catholic Church. Diocese of Chatham","Circular: In Fulfilment of the Canonical Duty Incumbent on All Bishops of the R.C. Church, to Visit Periodically the Apostolic See of Peter the Chief Pastor of the Universal Flock of Christ","","","","","https://archive.org/details/cihm_60670","Bishop (1860-1902 : Rogers)","1883","2022-01-19 18:32:56","2022-01-19 18:32:56","","","","","","","","","CIHM/ICMH Microfiche series = CIHM/ICMH collection de microfiches ; no. 60670","","","","N.p.","[Chatham, NB]","English","","","YorkU, UNBF (mic)","","","","","","","","","","","","","","","","","","","","","","","","","","","","","","","","","","","","","","","","","","","","","","","","","","","","","","",""
"TQ9X3V3T","book","1885","Richard, Marcel-Francois; Societe de colonisation acadienne","Rapport sur la colonisation par le Rév. M. F. Richard, président et trésorier de la Société de colonisation acadienne, pour l'année 1885","","","","","https://catalog.hathitrust.org/Record/100272667","Catholic, Acadian, Migration","1885","2022-01-19 18:32:56","2022-01-19 18:32:56","","","14","","","","","","CIHM/ICMH microfiche series ; no. 13765","","","","Imprimerie du Courrier des provinces Maritimes","Bathurst, NB","French","","","UNBF (mic)","","","","","","","","","","","","","","","","","","","","","","","","","","","","","","","","","","","","","","","","","","","","","","","","","","","","","","",""
"VMIC24WS","journalArticle","1937","Caron, I.","La Diocese de Quebec, Divisions et Subdivisions de 1674 a 1844","Rapport: La Société Canadienne d'Histoire de l'Eglise Catholique","","","","","Catholic [French version held at UNB? unclear from record]","1937","2022-01-19 18:32:56","2022-01-19 18:32:56","","11-47","","","","","","","","","","","","","French","","","UdeM","","","","","","","","","","","","","","","","","","","","","","","","","","","","","","","","","","","","","","","","","","","","","","","","","","","","","","",""
"J7889TV8","journalArticle","1972","Wade, Mason","Relations between the French, Irish and Scottish clergy in the Maritime provinces, 1774-1836","CCHA Study Sessions (Canadian Catholic Historical Association)","","03186156","","http://www.umanitoba.ca/colleges/st_pauls/ccha/Back%20Issues/CCHA1972/Wade.pdf","Catholic, Irish, Francophone, Scots","1972-01","2022-01-19 18:32:56","2022-01-19 18:32:56","","9-33","","","39","","","","","","","","","","","","","UofT","","","","","<p>Accession Number: 47303960; Wade, Mason; Source Info: 1972, Vol. 39, p9; Historical Period: 1774 to 1836; Subject Term: ETHNIC groups; Subject Term: CLERGY; Subject: CANADA; Subject: ATLANTIC Provinces; Number of Pages: 25p; Document Type: Article</p>; <p>Accession Number: 47303960; Wade, Mason; Source Info: 1972, Vol. 39, p9; Historical Period: 1774 to 1836; Subject Term: ETHNIC groups; Subject Term: CLERGY; Subject: CANADA; Subject: ATLANTIC Provinces; Number of Pages: 25p; Document Type: Article</p>","","","CANADA; CLERGY; ATLANTIC Provinces; CATHOLIC Church; ETHNIC groups","","","","","","","","","","","","","","","","","","","","","","","","","","","","","","","","","","","","","","","","","","","","","","",""
"JKEPEUFQ","book","1863","Wallace, M. A.; Indiana University. Digital Library Program; Committee on Institutional Cooperation","Well! Well!: A Tale, Founded on Fact","","","","","http://purl.dlib.indiana.edu/iudl/wright2/wright2-2615","Catholic, Fiction","1863","2022-01-19 18:32:56","2022-01-19 18:32:56","","","","","","312","","","Wright American fiction, 1851-1875","","","","D. & J. Sadlier","New York, NY","English","","","MtA","","","","","","","","","","","","","","","","","","","","","","","","","","","","","2nd ed.","","","","","","","","","","","","","","","","","","","","","","","","","",""
"D9699L3I","book","1992","Doherty, A.; Hynes, A.","Baptêmes, mariages, funérailles, Paroisse St-Joseph de Nash Creek 1867-1920","","","","","","Catholic, Parish registers","1992","2022-01-19 18:32:56","2022-01-19 18:32:56","","","244","","","","","","","","","","Société généalogique de Restigouche","","French","","","PANB","","","","","","","","","","","","","","","","","","","","","","","","","","","","","","","","","","","","","","","","","","","","","","","","","","","","","","",""
"Z952AHDW","book","1945","Dolan, J. E.","Sisters of Charity of the Immaculate Conception Mother House Saint Vincent's Convent, Saint John, New Brunswick","","","","","","Catholic, Women religious","1945","2022-01-19 18:32:56","2022-01-19 18:32:56","","","15","","","","","","","","","","P. A. Bray, C. J. M., Bishop of Saint John, N.B.","Saint John, NB","","","","MtA, Legislative Library","","","","","","","","","","","","","","","","","","","","","","","","","","","","","","","","","","","","","","","","","","","","","","","","","","","","","","",""
"QBNZ8WMT","book","1975","Doucet, Camille-Antonio","A la Défense de la minorité acadienne : conférence prononcée au congrès de la Société canadienne d'histoire de l'Église catholique","","","","","","Catholic","1975","2022-01-19 18:32:56","2022-01-19 18:32:56","","","13","","","","","A la défense de la minorité acadienne","","","","","N.p.","","","","","UdeM","","","","","","","","","","","","","","","","","","","","","","","","","","","","","","","","","","","","","","","","","","","","","","","","","","","","","","",""
"UR9APU5Q","book","1973","Dragon, Antonio S. J.","L'Acadie et ses 40 Robes Noires","","","","","","Catholic, Missions, Acadia","1973","2022-01-19 18:32:56","2022-01-19 18:32:56","","","244","","","","","","","","","","Les Éditions Bellarmin","Montreal, QC","French","","","UNBF, MtA, Acadia","","","","","","/home/cvillami/Zotero/storage/AMX9R45B/LAcadie-et-ses-40-Robes-Noires-Dragon-Antonio-SJ.html","","","","","","","","","","","","","","","","","","","","","","","","","","","","","","","","","","","","","","","","","","","","","","","","",""
"KJC58CP8","book","2003","Duguay, Henri-Eugène","Un Homme de Dieu: Père Donat Robichaud, 1892-1973","","978-0-9682742-7-9","","","","Catholic, Clergy, Biography","2003","2022-01-19 18:32:56","2022-01-19 18:32:56","","","158","","","","","Un homme de Dieu","","","","","Éditions ad hoc","Saint-André-LeBlanc, NB","","","","Legislative Library, Fredericton","","","","","","","","","New Brunswick; Nouveau-Brunswick; Catholic Church Clergy Biography; Église catholique Clergé Biographies; Robichaud, Donat","","","","","","","","","","","","","","","","","","","","","","","","","","","","","","","","","","","","","","","","","","","","","",""
"MWT6HACZ","book","2003","Doiron, Sylvio","Embellir","","","","","","Catholic, Clergy, Biography","2003","2022-01-19 18:32:56","2022-01-19 18:32:56","","","200","","","","","","","","","","Les Éditions Doiron","Moncton, NB","","","","Legislative Library, Fredericton","","","","","","","","","Catholic Church; Clergé Biographie; Clergy Biography; Église catholique","","","","","","","","","","","","","","","","","","","","","","","","","","","","","","","","","","","","","","","","","","","","","",""
"U8P4ITHK","book","1937","Donahoe, W. M.","Fifty Years a Parish, 1887-1937","","","","","","Catholic, Devon","1937","2022-01-19 18:32:56","2022-01-19 18:32:56","","","32","","","","","","","","","","St. Anthony of Padua [church]","Devon, NB","","","","UNBF","","","","","","","","","","","","","","","","","","","","","","","","","","","","","","","","","","","","","","","","","","","","","","","","","","","","","","",""
"55NAIZI8","book","1973","Doucet, Camille-Antonio","Une Étoile s'est levée en Acadie","","","","","","Trappist, Rogersville, Catholic","1973","2022-01-19 18:32:56","2022-01-19 18:32:56","","","312","","","","","","","","","","Pères trappistes","Rogersville, NB","French","","","UNBF","","","","","","","","","","","","","","","","","","","","","","","","","","","","","","","","","","","","","","","","","","","","","","","","","","","","","","",""
"S3DYMDQ5","thesis","1966","Doyle, Paul","The New Brunswick School Question, 1871-1875","","","","","","Catholic, Schools question, Education","1966","2022-01-19 18:32:56","2022-01-19 18:32:56","","","64","","","","","","","","","","Mount Allison University","Sackville, NB","","","B.A.","UdeM","","","","","","/home/cvillami/Zotero/storage/MHQQSRIV/results.html","","","","","","","","","","","","","","","","","","","","","","","","","","","","","","","","","","","","","","","","","","","","","","","","",""
"GDLGNPZ9","book","1997","Duguay, Henri-Eugène","Prêtre dans le coeur: Credo d'un prêtre-marié","","","","","","Catholic, Clergy, Biography","1997","2022-01-19 18:32:56","2022-01-19 18:32:56","","","192","","","","","Prêtre dans le coeur","","","","","Éditions ad hoc","Robichaud, NB","","","","UdeM","","","","","","/home/cvillami/Zotero/storage/D865LD5K/results.html","","","","","","","","","","","","","","","","","","","","","","","","","","","","","","","","","","","","","","","","","","","","","","","","",""
"74DIJFUL","book","2002","Duguay, Henri-Eugène","Toujours prêtre au service de l'Église : Confession d'un prêtre marié","","","","","","Catholic, Clergy, Biography","2002","2022-01-19 18:32:56","2022-01-19 18:32:56","","","159","","","","","Toujours prêtre au service de l'Église","","","","","Éditions ad hoc","Saint-Andre-Leblanc, NB","","","","UdeM","","","","","","","","","","","","","","","","","","","","","","","","","","","","","","","","","","","","","","","","","","","","","","","","","","","","","","",""
"ANU5UYBI","book","1999","Duguay, Henri-Eugène; Girouard, Anna","Raoul: un amour pas comme les autres: témoignages: Missionnaires laïc acadien","","978-0-9682742-2-4","","","","Catholic, Missions, Guatemala,  Laïcat","1999","2022-01-19 18:32:56","2022-01-19 18:32:56","","","128","","","","","Raoul","","","","","Éditions ad hoc","Robichaud, NB","","","","UdeM","","","","","","","","","","","","","","","","","","","","","","","","","","","","","","","","","","","","","","","","","","","","","","","","","","","","","","",""
"QQGVWASQ","book","1909","Église catholique Diocèse de Chatham; Barry, Thomas F.","Circulars and Pastoral Letters of His Lordship the Right Reverend Thomas Francis Barry, D. D., Bishop of Chatham, N.B.: To the Year 1909 Including Various Lists and Accounts Sent to the Clergy of the Diocese","","","","","https://archive.org/details/cihm_79528","Catholic (N.B.)","1909","2022-01-19 18:32:56","2022-01-19 18:32:56","","","292","","","","","","CIHM/ICMH microfiche series ; no. 79528 ; Évêque (1902-1920 : Barry)","","","","N.p.","Chatham, NB","","","","UdeM, UNBF (mic)","","","","","","","","","","","","","","","","","","","","","","","","","","","","","","","","","","","","","","","","","","","","","","","","","","","","","","",""
"ZM6KTSYL","book","1921","Eglise catholique Diocèse de Saint-Jean","Consititutiones dioecesis Sancti Joannis in America quae in synodo diocesana prima die 30a Novembris, habita in Ecclesia Cathedrali Immaculatae Conceptionis a Reverendissimo Eduardo Alfrido LeBlanc","","","","","","Catholic, Saint Jean (N.B.)","1921","2022-01-19 18:32:56","2022-01-19 18:32:56","","","84","","","","","","","","","","Action sociale","Quebec","","","","UdeM","","","","","","/home/cvillami/Zotero/storage/KB867VNW/results.html","","","","","","","","","","","","","","","","","","","","","","","","","","","","","","","","","","","","","","","","","","","","","","","","",""
"W8AVWWNF","book","1903","Église catholique. Diocèse de Saint-Jean; Casey, Thomas","Timothée, par la grâce de Dieu et du Siège apostolique, évêque de Saint Jean au clergé séculier et régulier, et à tous les fidèles de notre diocèse, salut et bénédiction dans le seigneur","","978-0-665-98639-0","","","https://archive.org/details/cihm_98639","Catholic, Prayer, Pastoral letters","1903","2022-01-19 18:32:56","2022-01-19 18:32:56","","","7","","","","","","CIHM/ICMH Microfiche series = CIHM/ICMH collection de microfiches ; no 98639 ; Évêque (1901-1912 : Casey)","","","","N.p.","Saint-Jean, NB","French","","","UNBF (mic)","","","","","","","","","","","","","","","","","","","","","","","","","","","","","","","","","","","","","","","","","","","","","","","","","","","","","","",""
"DDCB4VLB","book","1913","Église catholique. Diocèse de Saint-Jean; LeBlanc, Édouard A.","Mandement de Sa Grandeur Monseigneur Édouard LeBlanc, évêque de Saint-Jean : au clergé aux ordres religieux et aux fidèles de son diocèse","","978-0-665-98594-2","","","https://archive.org/details/cihm_98594","Catholic, Charges, Letters (N.B.)","1913","2022-01-19 18:32:56","2022-01-19 18:32:56","","","8","","","","","Mandement de Sa Grandeur Monseigneur Édouard LeBlanc, évêque de Saint-Jean","CIHM/ICMH Microfiche series = CIHM/ICMH collection de microfiches ;no. 98594 ; Évêque (1912-1935 : LeBlanc)","","","","Des Presses de ""L'Évangeline""","Moncton NB","","","","UdeM, UNBF (mic)","","","","","","","","","","","","","","","","","","","","","","","","","","","","","","","","","","","","","","","","","","","","","","","","","","","","","","",""
