"MIEH7AB7","book","2011","McGinn, Frances R.","Steadfast: Early Parishioners of the Roman Catholic Parish of St. Dunstan's, Fredericton, New Brunswick","","","","","","Catholic, Parishioners","2011","2022-01-19 18:32:56","2022-01-19 18:32:56","","","334","","","","","","","","","","N.p.","","","","","PANB, UNBF","","","","","","","","","","","","","","","","","","","","","","","","","","","","","","","","","","","","","","","","","","","","","","","","","","","","","","",""
"WK2NPZVX","book","2000","McGowan, Michael","The Canonical Status of Catholic Health Care Facilities in the Province of New Brunswick in Light of Recent Provincial Government Legislation","","978-0-7734-7683-7 978-0-88946-197-0","","","","Catholic, Politics, Medicine","2000","2022-01-19 18:32:56","2022-01-19 18:32:56","","","351","","","","","","Canadian studies ; v. 26","","","","Edwin Mellen Press","Lewiston, NY","English","","","UNBF","","","","","","","","","","","","","","","","","","","","","","","","","","","","","","","","","","","","","","","","","","","","","","","","","","","","","","",""
"TYIN9LPI","book","2004","McGowan, Michael","Pax Vobis: A History of the Diocese of Saint John its Bishops and Parishes","","978-2-7468-1025-9","","","","Catholic","2004","2022-01-19 18:32:56","2022-01-19 18:32:56","","","126","","","","","","","","","","Éditions du Signe","Strasbourg, France","English","","","PANB, UNBF, UNBSJ","","","","","","","","","","","","","","","","","","","","","","","","","","","","","","","","","","","","","","","","","","","","","","","","","","","","","","",""
"TWK595GT","book","1980","McGraw, Liette; Kenny, Allen; Losier, Georgette","Historique de Ste-Rose: Histoire et traditions acadiennes","","","","","","","1980","2022-01-19 18:32:56","2022-01-19 18:32:56","","","","","","","","","","","","","Jeunesse Canada au Travail","Ste. Rose, NB","French","","","Legislative Library, Fredericton, MtA","","","","","","/home/cvillami/Zotero/storage/HJXMFWWR/Historique-de-Ste-Rose-Histoire-et-traditions-acadiennes-McGraw-Liette-Allen-Kenny-Georgette-Lo.html","","","","","","","","","","","","","","","","","","","","","","","","","","","","","","","","","","","","","","","","","","","","","","","","",""
"RJTJ74NL","journalArticle","1991","McKee-Allain, Isabelle","La Place des communautés religieuses de femmes dans le système d'éducation du Nouveau-Brunswick: un bilan socio-historique","Éducation et francophonie","","","","","Catholic, Women, Education","1991","2022-01-19 18:32:56","2022-01-19 18:32:56","","3-8","","3","19","","","","","","","","","","","","","UdeM, MtA, Acadia","","","","","","","","","","","","","","","","","","","","","","","","","","","","","","","","","","","","","","","","","","","","","","","","","","","","","","",""
"9UTRLNPX","book","1986","McNeil, Robert P.","Behold I Am With You ... : A History of St. Anthoy's Church, Fredericton, N.B.","","","","","","Catholic","1986","2022-01-19 18:32:56","2022-01-19 18:32:56","","","142","","","","","","","","","","Capital Free Press","Fredericton, NB","English","","","PANB, UNBF","","","","","","/home/cvillami/Zotero/storage/KQNZ7YIH/Behold-I-am-With-YouA-History-of-St-Anthonys-Church-Fredericton-NB-McNeil-Robert-P.html","","","","","","","","","","","","","","","","","","","","","","","","","","","","","","","","","","","","","","","","","","","","","","","","",""
"WPQKQCYA","thesis","1998","McGowan, Michael D.","The Canonical Status of Catholic Health Care Facilities in the Province of New Brunswick in the Light of Recent Provincial Government Legislation","","","","","https://login.proxy.hil.unb.ca/login?url=https://www-proquest-com.proxy.hil.unb.ca/docview/304487475?accountid=14611","Catholic, Politics, Medicine","1998","2022-01-19 18:32:56","2022-01-19 18:32:56","","","376","","","","","","","","","","University of Ottawa","Ottawa, ON","English","","Ph.D.","UNBF","","","","","","/home/cvillami/Zotero/storage/RZ9VBIJA/McGowan - 1998 - The canonical status of Catholic health care facil.pdf","","","Philosophy; religion and theology; Social sciences; New Brunswick; Health and environmental sciences; Canonical; Catholic; Health care facilities; Legislation; Provincial government","","","","","","","","","","","","","","","","","","","","","","","","","","","","","","","","","","","","","","","","","","","","","",""
"EFWFW3U3","book","1989","McGrath, Henry W.","The Most Pure Heart of Mary Parish, 1882-1989: A History","","","","","","Catholic, Barnaby River","1989","2022-01-19 18:32:56","2022-01-19 18:32:56","","","44","","","","","","","","","","Newcastle Printing Ltd.","Miramichi, NB","English","","","UNBF","","","","","","","","","","","","","","","","","","","","","","","","","","","","","","","","","","","","","","","","","","","","","","","","","","","","","","",""
"IDKTG43G","thesis","2007","McKillop, Laura","Sifting Through Catholic Tradition: Catholic Women Negotiate the Traditions of Their Church and Construct Religious Meaning","","","","","https://login.proxy.hil.unb.ca/login?url=https://www-proquest-com.proxy.hil.unb.ca/docview/304730282?accountid=14611","Catholic, Women","2007","2022-01-19 18:32:56","2022-01-19 18:32:56","","","166","","","","","","","","","","University of New Brunswick (Canada)","Fredericton, NB","English","","M.A.","UNBF","","","","","","/home/cvillami/Zotero/storage/ABK8XEM6/McKillop - 2007 - Sifting through Catholic tradition Catholic women.pdf","","","Philosophy; religion and theology; Social sciences","","","","","","","","","","","","","","","","","","","","","","","","","","","","","","","","","","","","","","","","","","","","","",""
"BLLRG5E9","book","1932","McLaughlin, Charles J.","Early Missionary Footprints in Acadie, 1604-1904","","","","","","Catholic, Missions","1932","2022-01-19 18:32:56","2022-01-19 18:32:56","","","61","","","","","","","","","","Leblanc","[St. John, QC]","English","","","UNBF, UdeM","","","","","","","","","","","","","","","","","","","","","","","","","","","","","","","","","","","","","","","","","","","","","","","","","","","","","","",""
"6NNP7M4A","book","1881","Rogers, James; Leo XIII, Pape","Lettre pastorale de Mgr. Jacques Rogers, Evêque de Chatham, publiant dans son Diocèse le Jubilé extraordinaire annoncé au monde catholique dans la lettre encyclique (datée le 12 mars 1881) de notre très-saint Père le Pape Léon XIII","","","","","https://www.canadiana.ca/view/oocihm.64859","Catholic","1881","2022-01-19 18:32:56","2022-01-19 18:32:56","","","17","","","","","","","","","","Typ. Moniteur Acadien","Shédiac, NB","","","","Legislative Library, Fredericton","","","","","Cover title","","","","New Brunswick; Catholic Church; Nouveau-Brunswick; Eglise catholique","","","","","","","","","","","","","","","","","","","","","","","","","","","","","","","","","","","","","","","","","","","","","",""
"NN8TXPMD","book","1867","Rogers, James","Pastoral letter of the Rt. Rev. James Rogers, D. D., Bishop of Chatham, to the clergy and laity of this diocese on the occasion of the eighteenth centenary celebration of the martyrdom of Saints Peter and Paul and the canonization of saints had in the Vatican Basilica of St. Peter at Rome on the 29th of June 1867","","","","","https://archive.org/details/cihm_94922","Catholic","1867","2022-01-19 18:32:56","2022-01-19 18:32:56","","","51","","","","","","","","","","Propaganda Polyglot Press","Rome, Italy","","","","Legislative Library, Fredericton","","","","","","","","","New Brunswick; Catholic Church; Northumberland County Chatham; Pastoral letters and charges","","","","","","","","","","","","","","","","","","","","","","","","","","","","","","","","","","","","","","","","","","","","","",""
"LQDTVFH2","book","1930","Rogers McLeod, Grace","Pioneer Missionaries in the Atlantic Provinces","","","","","","Missions, Clergy, Silas Tertius Rand, Henry Alline, Jacob Bailey, William Black, James Drummond McGregor, Jean Maudet Sigoine","1930","2022-01-19 18:32:56","2022-01-19 18:32:56","","","64","","","","","","The Ryerson Canadian history readers","","","","Ryerson","Toronto, ON","English","","","UdeM, UNBF","","","","","","","","","","","","","","","","","","","","","","","","","","","","","","","","","","","","","","","","","","","","","","","","","","","","","","",""
"Q7JYHKH8","book","1944","Rose-Marie","Marie dans l'education nationale en Acadie","","","","","","Catholic, Acadians, Education, Mary","1944","2022-01-19 18:32:56","2022-01-19 18:32:56","","","77","","","","","","","","","","Fides","Montréal, QC","English","","","UNBF","","","","","","","","","","","","","","","","","","","","","","","","","","","","","","","","","","","","","","","","","","","","","","","","","","","","","","",""
"DCBLHAW5","journalArticle","1989","Rosenfeld, Roslyn","Allain, Marie-Helene. Sculpture. Gallery 78. Fredericton // Review","ArtsAtlantic","","0704-7916","","","Catholic, Women religious, Art","1989","2022-01-19 18:32:56","2022-01-19 18:32:56","","10-11","","3","9","","","","","","","","","","","","","UNBF","","","","","","","","","","","","","","","","","","","","","","","","","","","","","","","","","","","","","","","","","","","","","","","","","","","","","","",""
"N8ZIX2Z8","book","1955","Rumilly, Robert","Histoire des Acadiens","","","","","","Catholic, Acadian","1955","2022-01-19 18:32:56","2022-01-19 18:32:56","","","1038","","","2","","","","","","","Fides","Montréal, QC","French","","","UNBF","","","","","","","","","","","","","","","","","","","","","","","","","","","","","","","","","","","","","","","","","","","","","","","","","","","","","","",""
"WRFW9JP6","journalArticle","1987","Sabat, Christina","Allain, Marie-Helene. Sculptures. Beaverbrook Art Gallery. Fredericton // Review","ArtsAtlantic","","0704-7916","","","Catholic, Women religious, Art","1987","2022-01-19 18:32:56","2022-01-19 18:32:56","","7-8","","3","7","","","","","","","","","","","","","UNBF","","","","","","","","","","","","","","","","","","","","","","","","","","","","","","","","","","","","","","","","","","","","","","","","","","","","","","",""
"EQICW775","book","1934","Savage, Edward","Thirty Years in Moncton","","","","","","Catholic, St. Bernard's Church, Moncton, Westmorland County","1934","2022-01-19 18:32:56","2022-01-19 18:32:56","","","43","","","","","","","","","","N.p.","[Moncton, NB]","English","","","Legislative Library, Fredericton, MtA","","","","","","","","","New Brunswick; Church history; Catholic Church; Westmorland County Moncton; St. Bernard's Church (Moncton, N.B.)","","","","","","","","","","","","","","","","","","","","","","","","","","","","","","","","","","","","","","","","","","","","","",""
"LGU89VE6","book","1979","Savoie, Calixte F.","Memoires D'un Nationaliste Acadien","","","","","","Catholic, Acadian Nationalism, Education","1979","2022-01-19 18:32:56","2022-01-19 18:32:56","","","355","","","","","","","","","","Editions d'Acadie","Moncton, NB","French","","","UNBF","","","","","","/home/cvillami/Zotero/storage/C4EVIRUS/Memoires-Dun-Nationaliste-Acadien-Savoie-Calixte-F.html","","","","","","","","","","","","","","","","","","","","","","","","","","","","","","","","","","","","","","","","","","","","","","","","",""
"IVSWE92K","book","2004","Savoie, Guy; LeBlanc, Mariline","La Paroisse Saint-Anselme célèbre le ""centenaire"" de son église : 1904-2004 ; 100 ans d'héritage de foi","","","","","","Catholic","2004","2022-01-19 18:32:56","2022-01-19 18:32:56","","","12","","","","","","","","","","N.p.","New Brunswick","","","","UdeM","","","","","","","","","","","","","","","","","","","","","","","","","","","","","","","","","","","","","","","","","","","","","","","","","","","","","","",""
"XF4ULIA3","journalArticle","1930","Rogers, Normand","The Abbé Le Loutre","Canadian Historical Review","","","","https://utpjournals-press.proxy.hil.unb.ca/doi/abs/10.3138/CHR-011-02-03","Catholic","1930","2022-01-19 18:32:56","2022-01-19 18:32:56","","105-128","","2","11","","","","","","","","","","","","","UNBF","","","","","","","","","","","","","","","","","","","","","","","","","","","","","","","","","","","","","","","","","","","","","","","","","","","","","","",""
"Z9QNV8V9","journalArticle","2000","Pardini, Nadia","Distant Flocks: Spiritual Assistance to Catholic Communities in New Brunswick, 1763-1845: A Note","Rivista di Studi Canadesi","","11203420","","","Catholic, Missions, Irish, French, Language","2000-01","2022-01-19 18:32:56","2022-01-19 18:32:56","","121-126","","","13","","Rivista di Studi Canadesi","","","","","","","","","","","McGill, Concordia","","","","","<p>Accession Number: 46939294; Pardini, Nadia; Source Info: Jan2000, Vol. 13, p121; Note: Based on material in archdiocesan, local public, and Vatican archives and secondary sources; 23 notes.; Historical Period: 1763 to 1846; Subject Term: IRISH Canadians; Subject Term: CLERGY; Subject: CANADA; Subject: NEW Brunswick; Number of Pages: 6p; Document Type: Article</p>; <p>Accession Number: 46939294; Pardini, Nadia; Source Info: Jan2000, Vol. 13, p121; Note: Based on material in archdiocesan, local public, and Vatican archives and secondary sources; 23 notes.; Historical Period: 1763 to 1846; Subject Term: IRISH Canadians; Subject Term: CLERGY; Subject: CANADA; Subject: NEW Brunswick; Number of Pages: 6p; Document Type: Article</p>","","","CANADA; CLERGY; NEW Brunswick; CATHOLIC Church; IRISH Canadians","","","","","","","","","","","","","","","","","","","","","","","","","","","","","","","","","","","","","","","","","","","","","","",""
"W6H79578","book","2004","Saulnier, Zoël","De la savane...à la dune","","978-2-923016-64-1","","","","Catholic, Clergy, Biography","2004","2022-01-19 18:32:56","2022-01-19 18:32:56","","","204","","","","","","","","","","Les Éditions de la Francophonie","Moncton, NB","","","","Legislative Library, Fredericton","","","","","","","","","New Brunswick; Nouveau-Brunswick; Catholic Church Clergy Biography; Église catholique Clergé Biography","","","","","","","","","","","","","","","","","","","","","","","","","","","","","","","","","","","","","","","","","","","","","",""
"AR4NZID6","book","","Robichaud, Norbert","Lettre pastorale de son excellence Mgr Norbert Robichaud sur la vierge marie dispensatrice de vie chretienne.","","","","","","Catholic, Mary, Devotion","n.d.","2022-01-19 18:32:56","2022-01-19 18:32:56","","","16","","","","","","","","","","Archdiocese of Moncton","Moncton, NB","","","","UQ à Trois-Rivières","","","","","","/home/cvillami/Zotero/storage/EYYLGBYD/Lettre-Pastorale-de-Son-Excellence-Mgr-Norbert-Robichaud-Archeveque-de-Moncton-Volume-1-4-Robic.html","","","","","","","","","","","","","","","","","","","","","","","","","","","","","","","","","","","","","","","","","","","","","","","","",""
"2LTUN2VQ","book","1995","Schell, Christina R. L.","Tragedy Travel Triumph","","","","","","Catholic, Women religious","1995","2022-01-19 18:32:56","2022-01-19 18:32:56","","","94","","","","","","","","","","The Catholic Bookstore","Saint John, NB","English","","","LAC","","","","Author is an SCIC member. This book is about the Schell family, five Schell sisters joined the SCIC.","","","","","","","","","","","","","","","","","","","","","","","","","2","","","","","","","","","","","","","","","","","","","","","","","","","",""
"Z288S5DP","book","1984","Schuyler, George W.","Saint John: Scenes From a Popular History","","","","","","Catholic","1984","2022-01-19 18:32:56","2022-01-19 18:32:56","","","80","","","","","","","","","","Petheric Press","Halifax, NS","","","","UNBF, UNBSJ, Legislative Library, Fredericton","","","","","","","","","","","","","","","","","","","","","","","","","","","","","","","","","","","","","","","","","","","","","","","","","","","","","","",""
"BJ8BXD43","thesis","1984","See, Scott W.","Nativism and Social Violence in Mid-Nineteenth Century New Brunswick, Canada","","","","","","Catholic, Protestant, Orange Order, Irish","1984","2022-01-19 18:32:56","2022-01-19 18:32:56","","","277","","","","","","","","","","University of Maine","","","","Ph.D.","UNBF (mic), UNBSJ (mic), Dalhousie","","","","","<p>Accession Number: 46900017; See, Scott William; Source Info: 1985, Vol. 46 Issue 4, p1065; Note: Dissertation Publication Information: U. of Maine 1984. 277 pp.; Historical Period: 1840 to 1849; Subject Term: VIOLENCE; Subject Term: RELIGION; Subject Term: NATIVISM; Subject Term: IRISH Canadians; Subject Term: EMIGRATION & immigration; Subject: CANADA; Subject: NEW Brunswick; Number of Pages: 2p; Document Type: Dissertation</p>; <p>Accession Number: 46900017; See, Scott William; Source Info: 1985, Vol. 46 Issue 4, p1065; Note: Dissertation Publication Information: U. of Maine 1984. 277 pp.; Historical Period: 1840 to 1849; Subject Term: VIOLENCE; Subject Term: RELIGION; Subject Term: NATIVISM; Subject Term: IRISH Canadians; Subject Term: EMIGRATION & immigration; Subject: CANADA; Subject: NEW Brunswick; Number of Pages: 2p; Document Type: Dissertation</p>","","","CANADA; NEW Brunswick; EMIGRATION & immigration; RELIGION; IRISH Canadians; NATIVISM; VIOLENCE","","","","","","","","","","","","","","","","","","","","","","","","","","","","","","","","","","","","","","","","","","","","","","",""
"X8IQ5K84","book","1929","Sharkey, Hugh F. X.","The Loom of the Fairies","","","","","","Catholic, Saint John, Poetry","1929","2022-01-19 18:32:56","2022-01-19 18:32:56","","","71","","","","","","","","","","McMillan Press","Saint John, NB","","","","UNBF, Legislative Library Fredericton","","","","","","","","","","","","","","","","","","","","","","","","","","","","","","","","","","","","","","","","","","","","","","","","","","","","","","",""
"Z4BJPLRT","book","1954","Sharkey, Hugh F. X.","Vagabondia","","","","","","Catholic, Saint John, Poetry, Clergy","1954","2022-01-19 18:32:56","2022-01-19 18:32:56","","","173","","","","","","","","","","Editora del Caribe","Ciudad Trujillo, Republica Dominicana","","","","Legislative Library, Fredericton","","","","","","","","","","","","","","","","","","","","","","","","","","","","","","","","","","","","","","","","","","","","","","","","","","","","","","",""
"PTG3H3U4","book","2000","Savoie, Joseph; Joseph the Carpenter","The Unabridged Truth","","","","","","Catholic, Doctrine","2000","2022-01-19 18:32:56","2022-01-19 18:32:56","","","78","","","","","","","","","","Joseph Savoie","Saint John, NB","","","","Legislative Library, Fredericton","","","","","","","","","Catholic Church; Doctrines","","","","","","","","","","","","","","","","","","","","","","","","","","","","","","","","","","","","","","","","","","","","","",""
"LP4CB2ZG","book","1925","Rovolt, J. B.","Vie du T. R. P. Ange Le Doré, supérieur général des Eudistes (1834-1919)","","","","","","Catholic","1925","2022-01-19 18:32:56","2022-01-19 18:32:56","","","","","","2","","","","","","","Jacques & Demontrons","Besançon, France","","","","NBM, Legislative Library, Fredericton","","","","","","","","","","","","","","","","","","","","","","","","","","","","","","","","","","","","","","","","","","","","","","","","","","","","","","",""
"H2M2E3PM","book","1978","Savoie, Alexandre J.","Un Siecle de Revendications Scolaires au Nouveau Brunswick 1871-1971","","","","","","Catholic, Women religious","1978","2022-01-19 18:32:56","2022-01-19 18:32:56","","","255","","","2","","","","","","","l'Imprimerir Gagné Ltée","Montreal, QC","French","","","UNBF","","","","","","","","","","","","","","","","","","","","","","","","","","","","","","","","","","","","","","","","","","","","","","","","","","","","","","",""
"VC2JI7SV","book","1987","Schell, Christina R. L.","Tragedy Travel Triumph","","","","","","Catholic, Women religious","1987","2022-01-19 18:32:56","2022-01-19 18:32:56","","","94","","","","","","","","","","Sisters of Charity of the Immaculate Conception","Saint John, NB","English","","","Sisters of Charity of the Immaculate Conception Archives, Legislative Library, Fredericton","","","","Author is an SCIC member. This book is about the Schell family, five Schell sisters joined the SCIC.","","","","","","","","","","","","","","","","","","","","","","","","","1","","","","","","","","","","","","","","","","","","","","","","","","","",""
"SB36CRM6","journalArticle","1977","Sirois, Georges","L'Evolution Historique de l'Enseignement Public au Madawaska Pendant le XIXième Siecle","Le Brayon","","","","http://www.demelerlespinceaux.umce.ca/static/pdf/L%20evolution%20historique%20de%20l%20enseignement%20public%20au%20Madawaska%2019e%20siecle_SHM.pdf","Catholic, Women religious [Le Brayon is the journal of La Société historique du Madawaska]","1977","2022-01-19 18:32:56","2022-01-19 18:32:56","","3-29","","2","5","","","","","","","","","","French","","","MtA, UdeM","","","","","","","","","","","","","","","","","","","","","","","","","","","","","","","","","","","","","","","","","","","","","","","","","","","","","","",""
"SFASU6HX","book","2007","Smyth, Elizabeth M.","Changing Habits: Women's Religious Orders in Canada","","978-2-89507-903-3","","","","The contribution of convent schools to the development of the French language in late nineteenth-century New Brunswick / Sheila Andrew -- Charity in the East : sectarianism, ethnicity and gender in Saint John, New Brunswick, schools / Elizabeth W. McGahan -- An educational odyssey: the Sisters of Charity of Halifax / Mary Olga McKenna -- Entering the convent as coming of age in the 1930s / Heidi MacDonald -- Blasphemes of modernity: scandals of the nineteenth-century Quebec convent / Rebecca Sullivan -- Sites of prayer and pilgrimage within a convent: the architectural manifestations of a religious vocation / Tania Martin -- ""The harvest that lies before us"": Quebec women religious building health care in the U.S. Pacific Northwest, 1858-1900 / Sioban Nelson -- The educational work of the Loretto Sisters in Ontario, 1847-1983 / Christine Lei -- Writing a congregational history: the insider problematic / Veronica O'Reilly -- Teaching sisters, leading schools: two 20th-century Canadian women religious in educational leadership / Elizabeth M. Smyth -- The process of transformation: women religious and the study of theology, 1955-1980 / Ellen leonard -- The process of renewal of the Missionary Oblate Sisters, 1963-1989 / Rosa Bruno-Jofré -- Gender and mission: The Sisters of Saint Ann in British Columbia / Jacqueline Gresko.","2007","2022-01-19 18:32:56","2022-01-19 18:32:56","","","","","","","","","","","","","Novalis","Ottawa, ON","English","","","UNBF, MtA","","","","","","","","","","","","","","","","","","","","","","","","","","","","","","","","","","","","","","","","","","","","","","","","","","","","","","",""
"W4NUX8GS","book","1993","Société historique Nicolas Denys","Régistre des actes de baptêmes, Paroisse St-Joseph et St-Jean-Baptiste, Tracadie, N.-B., 1798-1860","","","","","","Catholic, Parish registers","1993","2022-01-19 18:32:56","2022-01-19 18:32:56","","","388","","","","","","","","","","La Société","Shippagan, NB","","","","UdeM","","","","","","","","","","","","","","","","","","","","","","","","","","","","","","","","","","","","","","","","","","","","","","","","","","","","","","",""
"CCMCIHGB","book","1994","Société historique Nicolas Denys","Régistre des actes de baptêmes, Paroisse St-Joseph et St-Jean-Baptiste, Tracadie, N.-B., 1861-1875","","","","","","Catholic, Parish registers","1994","2022-01-19 18:32:56","2022-01-19 18:32:56","","","[219]","","","","","","","","","","La Société","Shippagan, NB","","","","UdeM","","","","","","","","","","","","","","","","","","","","","","","","","","","","","","","","","","","","","","","","","","","","","","","","","","","","","","",""
"ZLYVECQH","book","2002","Sheila Hugh Mackay Foundation; Smart, Tom","Caught in the Presence of Dreams","","978-0-9685999-7-6","","","","","2002","2022-01-19 18:32:56","2022-01-19 18:32:56","","","47","","","","","","","","","","Otnabog Editions for the Sheila Hugh Mackay Foundation","Gagetown, NB","","","","UNBF, Legislative Library, Fredericton","","","","","","","","","","","","","Smart, Tom","","","","","","","","","","","","","","","","","","","","","","","","","","","","","","","","","","","","","","","","","",""
"CCNWQK7B","book","1911","Simpson, F. C.","Rev. F.C. Simpson's Third Sermon on the Ne Temere Decree","","978-0-665-98678-9","","","https://www.canadiana.ca/view/oocihm.98678","Catholic, Sermons, Marriage","1911","2022-01-19 18:32:56","2022-01-19 18:32:56","","","","","","","","","CIHM/ICMH Microfiche series ; no. 98678","","","","N.p.","[Douglastown, NB]","English","","","UNBF (mic), Acadia","","","","","","","","","","","","","","","","","","","","","","","","","","","","","","","","","","","","","","","","","","","","","","","","","","","","","","",""
"QZ77HQ2X","book","1990","Societe Historique Nicolas Denys","Actes de baptemes paroisse Saint-Jerome, Shippagan, NB, 1824-1920","","","","","","Catholic, Baptism records","1990","2022-01-19 18:32:56","2022-01-19 18:32:56","","","488","","","","","","","","","","Societe Historique Nicolas-Denys","Shippagan, NB","French","","","PANB","","","","","","","","","","","","","","","","","","","","","","","","","","","","","","","","","","","","","","","","","","","","","","","","","","","","","","",""
"4E7XTW6I","book","1994","Société historique Nicolas Denys","Régistre des actes de baptêmes de la Paroisse de Tracadie, NB","","","","","","Catholic, Parish registers","1994","2022-01-19 18:32:56","2022-01-19 18:32:56","","","388","","","","","","","","","","[La Société]","[Shippagan, NB]","","","","UdeM","","","","","","","","","","","","","","","","","","","","","","","","","","","","","","","","","","","","","","","","","","","","","","","","","","","","","","",""
